weather_data.csv

City,Temperature,Humidity,Weather Condition,Wind Speed,Date & Time
Lagos,23.82,93,Rain,3.28,2026-07-17 11:05:30
Abuja,24.61,79,Clouds,2.25,2026-07-17 11:05:30
Port Harcourt,22.84,99,Rain,2.03,2026-07-17 11:05:31

README.md

# Data captured on July 17, 2026, at 11:05 AM

1. Temperature Variation
Abuja recorded the warmest reading at 24.61°C, Lagos sat in the middle at 23.82°C, and Port Harcourt was the coolest at 22.84°C, influenced by active regional rain.

3. Wind Speed & Air Circulation
Lagos had the strongest winds at 3.28 m/s (coastal breeze), Abuja was moderate at 2.25 m/s, and Port Harcourt was the calmest at 2.03 m/s.